{
  "$schema": "https://json-schema.org/draft/2020-12/schema",
  "$id": "atlas://packages/contracts/atlas.receipt.v1.schema.json",
  "title": "ATLAS receipt contract v1",
  "description": "Receipt envelope for accepted, rejected, verification, and warning outcomes at the ATLAS platform boundary.",
  "type": "object",
  "additionalProperties": false,
  "required": [
    "contract_version",
    "receipt_id",
    "recorded_at",
    "repo_id",
    "app_id",
    "kind",
    "status",
    "subject",
    "evidence",
    "links"
  ],
  "properties": {
    "contract_version": {
      "type": "string",
      "const": "atlas.receipt.v1"
    },
    "receipt_id": {
      "type": "string",
      "minLength": 1
    },
    "recorded_at": {
      "type": "string",
      "format": "date-time"
    },
    "repo_id": {
      "type": "string",
      "pattern": "^[a-z0-9][a-z0-9-]*$"
    },
    "app_id": {
      "type": "string",
      "pattern": "^[a-z0-9][a-z0-9-]*$"
    },
    "kind": {
      "type": "string",
      "minLength": 1
    },
    "status": {
      "type": "string",
      "enum": [
        "accepted",
        "rejected",
        "passed",
        "failed",
        "skipped",
        "warning"
      ]
    },
    "subject": {
      "$ref": "#/$defs/subject"
    },
    "evidence": {
      "type": "array",
      "items": {
        "$ref": "#/$defs/evidence"
      }
    },
    "links": {
      "type": "array",
      "items": {
        "$ref": "#/$defs/link"
      }
    },
    "summary": {
      "type": [
        "string",
        "null"
      ],
      "minLength": 1
    },
    "event_id": {
      "type": [
        "string",
        "null"
      ],
      "minLength": 1
    }
  },
  "$defs": {
    "subject": {
      "type": "object",
      "additionalProperties": false,
      "required": [
        "kind",
        "id"
      ],
      "properties": {
        "kind": {
          "type": "string",
          "minLength": 1
        },
        "id": {
          "type": "string",
          "minLength": 1
        },
        "path": {
          "type": [
            "string",
            "null"
          ],
          "minLength": 1
        }
      }
    },
    "evidence": {
      "type": "object",
      "additionalProperties": false,
      "required": [
        "kind",
        "ref"
      ],
      "properties": {
        "kind": {
          "type": "string",
          "minLength": 1
        },
        "ref": {
          "type": "string",
          "minLength": 1
        },
        "digest": {
          "type": [
            "string",
            "null"
          ],
          "minLength": 1
        },
        "summary": {
          "type": [
            "string",
            "null"
          ],
          "minLength": 1
        }
      }
    },
    "link": {
      "type": "object",
      "additionalProperties": false,
      "required": [
        "rel",
        "href"
      ],
      "properties": {
        "rel": {
          "type": "string",
          "minLength": 1
        },
        "href": {
          "type": "string",
          "minLength": 1
        }
      }
    }
  }
}
